aid,fname,lname,birth_date,birth_country,birth_city,overall_rating,gender,description
nm0889024,Charles,Vanel,08/21/1892,France,Ille-et-Vilaine,0,0,"Charles Vanel was a French actor. His film career lasted for 76 years, from 1912 to 1988. He appeared in over 200 films."
nm0000080,Orson,Welles,05/06/1915,USA,Wisconsin,0,0,"His father, Richard Head Welles, was a well-to-do inventor, his mother, Beatrice (Ives) Welles, a beautiful concert pianist; Orson Welles was gifted in many arts (magic, piano, painting) as a child. When his mother died in 1924 (when he was nine) he traveled the world with his father. He was orphaned at 15 after his father's death in 1930 and became the ward of Dr. Maurice Bernstein of Chicago. In 1931, he graduated from the Todd School in Woodstock, Illinois. He turned down college offers for a sketching tour of Ireland. He tried unsuccessfully to enter the London and Broadway stages, traveling some more in Morocco and Spain. where he fought in the bullring"
nm0385443,Shin'ichi,Himori,01/10/1907,Japan,Tokyo,0,0,"Shin'ichi Himori was born on January 10, 1907 in Tokyo, Japan. He was an actor, known for"
nm4759838,Mone,Kamishiraishi,01/27/1998,Japan,Kagoshima,0,1,"Mone Kamishiraishi was born on January 27, 1998 in Kagoshima, Japan. She is an actress, known for"
nm1818216,Payman,Maadi,01/01/1970,USA,New York,0,0,Peyman Maadi was born in 1972 in New York City to an Iranian couple. His father was a lawyer. His family moved back to Iran when he was 5 years old. He graduated in Metallurgical Engineering from Karaj Azad University. Maadi started his film career as a screenwriter in late 2000s. He is the writer of several famous Iranian films. He started his acting career in
nm0000228,Kevin,Spacey,07/26/1959,USA,New Jersey,0,0,"Kevin Spacey Fowler, better known by his stage name Kevin Spacey, is an American actor of screen and stage, film director, producer, screenwriter and singer. He began his career as a stage actor during the 1980s before obtaining supporting roles in film and television. He gained critical acclaim in the early 1990s that culminated in his first Academy Award for Best Supporting Actor for the neo-noir crime thriller The Usual Suspects (1995), and an Academy Award for Best Actor for midlife crisis-themed drama American Beauty (1999)."
nm0000741,Tim,Allen,06/13/1953,USA,Colorado,0,0,"Timothy Allen Dick was born on June 13, 1953, in Denver, Colorado, to Martha Katherine (Fox) and Gerald M. Dick. His father, a real estate salesman, was killed in a collision with a drunk driver while driving his family home from a University of Colorado football game, when Tim was eleven years old. His mother, a community service worker, remarried her high school sweetheart, an Episcopalian deacon, two years after Tim's father's death. He was raised with his many siblings and step-siblings. When Tim was young, his family moved to Birmingham, Michigan."
nm0000474,Michael,Keaton,09/05/1951,USA,Pennsylvania,0,0,"Quirky, inventive and handsome American actor Michael Keaton first achieved major fame with his door-busting performance as fast-talking ideas man Bill Blazejowski, alongside a nerdish morgue attendant ("
nm0000606,Jean,Reno,07/30/1948,French Protectorate of Morocco [now Morocco],Casablanca,0,0,"Jean Reno was born Juan Moreno y Herrera-Jiménez in Casablanca, Morocco, to Spanish parents (from Andalucía) who moved to North Africa to seek work. His father was a linotypist. Reno settled in France at 17. He began studying drama and has credits in French television and theater as well as films. His first two marriages both ended in divorce, and he had two children with each of them. He keeps homes in Paris and Los Angeles."
nm0454120,Takuya,Kimura,11/13/1972,Japan,Tokyo,0,0,"Takuya Kimura was born on November 13, 1972 in Tokyo, Japan. He is an actor, known for"
nm0309945,Maxim,Gaudette,06/08/1974,Canada,Quebec,0,0,"Maxim Gaudette was born on June 8, 1974 in Sherbrooke, Quebec, Canada. He is an actor, known for"
nm0000151,Morgan,Freeman,06/01/1937,USA,Tennessee,0,0,"With an authoritative voice and calm demeanor, this ever popular American actor has grown into one of the most respected figures in modern US cinema. Morgan was born on June 1, 1937 in Memphis, Tennessee, to Mayme Edna (Revere), a teacher, and Morgan Porterfield Freeman, a barber. The young Freeman attended Los Angeles City College before serving several years in the US Air Force as a mechanic between 1955 and 1959. His first dramatic arts exposure was on the stage including appearing in an all-African American production of the exuberant musical Hello, Dolly!."
nm0000114,Steve,Buscemi,12/13/1957,USA,New York,0,0,"Steve Buscemi was born in Brooklyn, New York, to Dorothy (Wilson), a restaurant hostess, and John Buscemi, a sanitation worker. He is of Italian (father) and English, Dutch, and Irish (mother) descent. He became interested in acting during his last year of high school. After graduating, he moved to Manhattan to study acting with John Strasberg. He began writing and performing original theatre pieces with fellow actor/writer"
nm0001527,Elizabeth,McGovern,07/18/1961,USA,Illinois,0,1,"Daughter of a law professor at Northwestern University, she moved with her family to Los Angeles when he transferred to the University of California at Los Angeles (U.C.L.A.). She began acting in school plays at North Hollywood High, graduated from The Oakwood School and then continued her stage training at the American Conservatory Theatre in San Francisco and the drama division of The Juilliard School in New York. Following a pleasant screen debut in"
nm0841501,Mack,Swain,02/16/1876,USA,Utah,0,0,Mack Swain was born in 1876 and soon became a talented vaudevillian. In 1913 he was hired by
nm0005286,Haley,Joel,04/10/1988,USA,California,0,0,Haley Joel Osment is an American actor who has proven himself as one of the best young actors of his generation. He is the first millennial male to have received an Academy Award nomination for acting.
nm0821543,Enzo,Staiola,11/15/1939,Italy,Lazio,0,0,"Enzo Staiola was born on November 15, 1939 in Rome, Lazio, Italy. He is an actor, known for"
nm0305558,Gael,García,11/30/1978,Mexico,Guadalajara,0,0,Gael García Bernal was born in Guadalajara to
nm0000546,Matthew,Modine,03/22/1959,USA,California,0,0,"The youngest of seven, Matthew was born in Loma Linda, Ca, to Dolores (Warner), a bookkeeper, and Mark Alexander Modine, a drive-in theater manager. After graduating high school in Imperial Beach, Ca. Modine moved to NYC (1979). Matthew studied with Stella Adler at her Conservatory of Acting. While still a student of hers, he began landing starring roles in film, and later theatre and television. Matthew has worked with many of the most highly regarded directors including,"
nm0653942,Frank,Overton,03/12/1918,USA,New York,0,0,"Perpetually serious-looking New York-born character actor, who showed up to good effect in many TV shows of the 50's and 60's. His quietly authoritarian demeanor lent itself ideally to portraying characters with badges or uniforms: Sheriff Heck Tate in"
nm0309693,Mark,Gatiss,10/17/1966,UK,England,0,0,"Mark Gatiss is an accomplished author, actor and playwright. Originally from Sedgefield, County Durham, he graduated from Bretton Hall Drama College with a BA (honors) in Theatre Arts."
nm0749363,Rufus, ,12/19/1942,France,Puy-de-Dôme,0,0,"Rufus was born on December 19, 1942 in Riom, Puy-de-Dôme, France. He is an actor, known for"
nm0233145,Alison,Doody,11/11/1966,Ireland,Dublin,0,1,"Alison Doody was born in Dublin in 1966, in a well-off family. She is the youngest of three children. She was educated in a convent, where she gained a passion for the arts. She later studied at the National College of Fine Arts in Dublin, but left because she lacked the motivation and thought she would take a year off to think it out. Meanwhile, while sitting in a café with friends, she was approached by a still photographer who asked her if she would be interested to model. Thinking she could use the pocket money, she said yes. Modeling proved to be both fun and lucrative, and very soon she did it professionally. Her modeling contracts led to commercial work, which would take her around the world. One day, a casting director saw her work and suggested she try acting instead. She was sent to London at age 19, where she quickly won an audition to appear in the new James Bond film,"
nm0570230,Kathryn,McGuire,12/06/1903,USA,Illinois,0,1,"Kathryn McGuire was born on December 6, 1903 in Peoria, Illinois, USA. She was an actress, known for"
nm0000345,Billy,Crystal,03/14/1948,USA,New York,0,0,"Billy Crystal was born on March 14, 1948 in Manhattan, New York, and was raised on Long Island. He is the youngest of three sons born to Helen (Gabler) and Jack Crystal. His father was a well-known concert promoter who co-founded Commodore Records and his mother was a homemaker. His family were Jewish emigrants from Russia, Austria, and Lithuania. With his father in the music business, Billy was no stranger to some of the top performers of the time. Legends such as"
nm0849100,Yûko,Tanaka,04/29/1955,Japan,Osaka,0,1,"Yûko Tanaka was born on April 29, 1955 in Osaka, Japan. She is known for her work on"
nm2794962,Hailee,Steinfeld,12/11/1996,USA,California,0,1,"Hailee Steinfeld was born on December 11, 1996 in Tarzana, California, to Cheri (Domasin), an interior designer, and"
nm0246386,Mélissa,Désormeaux-Poulin,01/01/1970,unknown,unknown,0,1,"Mélissa Désormeaux-Poulin is an actress, known for"
nm0000314,Charles,Bronson,11/03/1921,USA,Pennsylvania,0,0,"The archetypal screen tough guy with weatherbeaten features--one film critic described his rugged looks as ""a"
nm0000349,Joan,Cusack,10/11/1962,USA,New York,0,1,"Actress Joan Cusack was born on October 11, 1962 in New York City and is the daughter of Nancy (née Carolan) and"
nm0997115,Miyu,Irino,02/19/1988,Japan,Tokyo,0,0,"Miyu Irino was born on February 19, 1988 in Tokyo, Japan. He is an actor, known for"
nm0753479,Chishû,Ryû,05/13/1904,Japan,Kumamoto,0,0,What an amazing career! Few can boast a longer one (64 years of activity). Few have been able to have to relate to three generations. And it is pretty sure that no one can compare with him in terms of faithfulness to a director: Chishu Ryu indeed appeared in no fewer than fifty-two out of fifty-four of his master
nm1419440,Ivana,Baquero,06/11/1994,Spain,Catalonia,0,1,"Ivana was born in Barcelona, Spain. She graduated High School at The American School of Barcelona."
nm0000152,Richard,Gere,08/31/1949,USA,Pennsylvania,0,0,"Humanitarian and actor Richard Gere was born on August 31, 1949, in Philadelphia, the second of five children of Doris Ann (Tiffany), a homemaker, and Homer George Gere, an insurance salesman, both Mayflower descendants. Richard started early as a musician, playing a number of instruments in high school and writing music for high school productions. He graduated from North Syracuse Central High School in 1967, and won a gymnastics scholarship to the University of Massachusetts in Amherst, where he majored in philosophy. He left college after two years to pursue acting, landing a lead role in the London production of the rock musical ""Grease"" in 1973. The following year he would be in other plays, such as ""Taming of the Shrew."" Onscreen, he had a few roles, and gained recognition in"
nm0297054,Gustav,Fröhlich,03/21/1902,Germany,Hanover,0,0,"Gustav Fröhlich was born on March 21, 1902 in Hanover, Germany. He was an actor and director, known for"
nm3918035,Zendaya, ,09/01/1996,USA,California,0,1,"Zendaya (which means ""to give thanks"" in the language of Shona) is an American actress and singer born in Oakland, California. She began her career appearing as a child model working for Macy's, Mervyns and Old Navy. She was a backup dancer before gaining prominence for her role as Rocky Blue on the Disney Channel sitcom"
nm0652663,Patton,Oswalt,01/27/1969,USA,Virginia,0,0,"Patton Oswalt has been headlining at comedy clubs all over the United States since 1996, as well as appearing in his own standup specials on Comedy Central and HBO. He was chosen as Entertainment Weekly's ""It"" comedian in 2002. He is a regular on"
nm7934649,Lijo,Mol,01/01/1970,unknown,unknown,0,1,"Lijo Mol Jose is an actress, known for"
nm0587256,Vera,Miles,08/23/1929,USA,Oklahoma,0,1,"Born in Boise City, Oklahoma, Vera Miles attended school in Pratt, Kansas and Wichita, Kansas. The patrician beauty of Miss Miles won her the title of ""Miss Kansas"" in 1948, leading soon to small roles in Hollywood films and television series. Fame came to the forthright, spirited Miles when she attracted the attention of two master directors,"
nm1886602,Miles,Teller,02/20/1987,USA,Pennsylvania,0,0,Miles Alexander Teller is an American actor and musician. For his performance in the film
nm0001330,Sterling,Hayden,03/26/1916,USA,New Jersey,0,0,"Born to George & Frances Simonson Walter, and named Sterling Relyea Walter. Father died in 1925. Adopted by stepfather 'James Hayden' renamed Sterling Walter Hayden. Grew up in New Hampshire, Massachusetts, Pennsylvania, Washington D.C., and Maine. Though very poor, attended prep school at Wassookeag School in Dexter, Maine. Ran away to sea at 17, first as ship's boy, then as doryman on the Grand Banks, as a seaman and fireman on numerous vessels before getting his first command at 19. He sailed around the world a number of times, becoming a well-known and highly respected ship's captain. At urging of friends, met with producer"
nm0602941,Nick,Moran,12/23/1969,UK,England,0,0,"Nick Moran was born on December 23, 1969 in East End, London, England. He is an actor and writer, known for"
nm0444172,Joe,Keaton,07/06/1867,USA,Indiana,0,0,"Joe Keaton and wife Myra were grade-Z vaudeville performers in the early 1900s. Their son Buster joined the act when he was only a few months old. The act was a rough-and-tumble one, with Buster being thrown around on stage most of the time. As the years went by, Joe Keaton became an alcoholic, which forced Buster to quit the act by the time he was a teenager. However, after he hit it big in silent film, Buster provided Joe with small parts in several movies. Myra and Joe split up long after Buster had become an adult. She'd had it with the constant verbal and physical abuse Joe put her through. He lived alone in a Hollywood hotel for many years and was said to have stopped drinking after becoming a Christian Scientist. Buster said Joe died as a result of being run over by a passing car."
nm0254402,Chris,Elliott,05/31/1960,USA,New York,0,0,"Chris Elliott was born on May 31, 1960 in New York City, New York, USA. He is an actor and writer, known for"
nm0001961,Ray,Bolger,01/10/1904,USA,Massachusetts,0,0,"Ray Bolger was born Raymond Wallace Bolger on January 10, 1904 in Dorchester, Massachusetts, to Anne C. (Wallace) and James Edward Bolger, both Irish-Americans. Ray began his career in vaudeville. He was half of a team called ""Sanford and Bolger"" and also did numerous Broadway shows on his own. Like"
nm9862859,Yordanos,Shiferaw,01/01/1970,unknown,unknown,0,1,"Yordanos Shiferaw is an actress, known for"
nm0001526,Patrick,McGoohan,03/19/1928,USA,New York,0,0,"Though born in America, Irish actor Patrick McGoohan rose to become the number-one British TV star in the 1950s to 1960s era. His parents moved to Ireland when he was very young and McGoohan acquired a neutral accent that sounds at home in British or American dialogue. He was an avid stage actor and performed hundreds of times in small and large productions before landing his first TV and film roles. McGoohan is one of few actors who has successfully switched between theater, TV, and films many times during his career. He was often cast in the role of Angry Young Man. In 1959, he was named Best TV Actor of the Year in Britain. Shortly thereafter, he was chosen for the starring role in the"
nm0576127,Ralph,Meeker,11/21/1920,USA,Minnesota,0,0,"Burly American character actor Ralph Meeker first acted on stage at his alma mater, Northwestern University, alongside other budding performers"
nm1502434,Leslie,Odom,08/06/1981,USA,New York,0,0,"Leslie Odom Jr. was born on August 6, 1981 in Queens, New York, USA. He is an actor and producer, known for"
nm8904193,Manikandan,K.,01/01/1970,unknown,unknown,0,0,"Manikandan was born in Chennai, Tamil Nadu. In initial years of his career he worked as a mimicry artist and then as a RJ and later, he started to work as a dubbing/voice artist in TV serials and films. He has written dialogues for various tamil films. He has also acted in some of the tamil blockbuster movie like"
nm0897640,Mónica,Villa,01/01/1970,Argentina,unknown,0,1,"Mónica Villa was born in 1954 in Argentina. She is an actress, known for"
nm0000246,Bruce,Willis,03/19/1955,West Germany,Idar-Oberstein,0,0,"Actor and musician Bruce Willis is well known for playing wisecracking or hard-edged characters, often in spectacular action films. Collectively, he has appeared in films that have grossed in excess of $2.5 billion USD, placing him in the top ten stars in terms of box office receipts."
nm0607865,Emily,Mortimer,10/06/1971,UK,England,0,1,"English actress Emily Kathleen Anne Mortimer was born in Hammersmith, London, England, to writer and barrister Sir"
nm0913822,Ken,Watanabe,10/21/1959,Japan,Uonuma,0,0,"Ken Watanabe was born on October 21, 1959 in Uonuma, Japan. Both of his parents were teachers: his mother taught general education and his dad taught calligraphy. He became interested in acting at the age of 24, when a director of England's National Theater Company, where he was studying, told him that acting was his special gift. In 1978, he moved to Tokyo to pursue acting. He drew the attention of the critics when"
nm0000023,Judy,Garland,06/10/1922,USA,Minnesota,0,1,"One of the brightest, most tragic movie stars of Hollywood's Golden Era,"
nm0181425,Jesse,Corti,07/03/1955,Venezuela,unknown,0,0,"Jesse Corti was born on July 3, 1955 in Venezuela. He is known for his work on"
nm3154303,Timothée,Chalamet,12/27/1995,USA,New York,0,0,"Timothée Hal Chalamet was born in Manhattan, to"
nm0865949,Goya,Toledo,09/24/1969,Spain,Canary Islands,0,1,"Goya Toledo was born on September 24, 1969 in Lanzarote, Canary Islands, Spain. She is an actress, known for"
nm9862858,Zain,Al,10/10/2004,Syria,Daraa,0,0,"Zain Al Rafeea is an actor, known for Capharnaüm (2018). Zain was a Syrian refugee when he was discovered in the streets of Beirut by director Nadine Labaki. At the time, his life shared similarities with that of his character of the same name. He and his family have since been resettled in Norway."
nm0910607,Christoph,Waltz,10/04/1956,Austria,Vienna,0,0,Christoph Waltz is an Austrian-German actor. He is known for his work with American filmmaker
nm0000510,Andie,MacDowell,04/21/1958,USA,South Carolina,0,1,"Andie MacDowell was born Rosalie Anderson MacDowell on April 21, 1958 in Gaffney, South Carolina, to Pauline Johnston (Oswald), a music teacher, and Marion St. Pierre MacDowell, a lumber executive. She was enrolled at Winthrop College located in Rock Hill, South Carolina. Initially discovered by a rep from Wilhelmina Models while on a trip to Los Angeles. Later signed on with Elite Model Management in New York City in 1978. Made debut film appearance in"
nm0249291,Joel,Edgerton,06/23/1974,Australia,New South Wales,0,0,"Joel Edgerton was born on June 23, 1974 in Blacktown, New South Wales, Australia, to Marianne (van Dort) and Michael Edgerton, who is a solicitor and property developer. His brother is filmmaker"
nm0000054,Marilyn,Monroe,06/01/1926,USA,California,0,1,"Marilyn Monroe was an American actress, comedienne, singer, and model. She became one of the world's most enduring iconic figures and is remembered both for her winsome embodiment of the Hollywood sex symbol and her tragic personal and professional struggles within the film industry. Her life and death are still the subjects of much controversy and speculation. She was born Norma Jeane Mortenson at the Los Angeles County Hospital on June 1, 1926. Her mother Gladys Pearl Baker was a film-cutter at Consolidated Film Industries. Marilyn's father's identity was never known. Because Gladys was mentally and financially unable to care for young Marilyn, Gladys placed her in the care of a foster family, The Bolenders. Although the Bolender family wanted to adopt Marilyn, Gladys was eventually able to stabilize her lifestyle and took Marilyn back in her care when Marilyn was 7 years old. However, shortly after regaining custody of Marilyn, Gladys had a complete mental breakdown and was diagnosed as a paranoid schizophrenic and was committed to a state mental hospital. Gladys spent the rest of her life going in and out of hospitals and rarely had contact with young Marilyn. Once Marilyn became an adult and celebrated as a film star, she paid a woman by the name of Inez Melson to look in on the institutionalized Gladys and give detailed reports of her progress. Gladys outlived her daughter, dying in 1984."
nm0000059,Laurence,Olivier,05/22/1907,UK,England,0,0,Laurence Olivier could speak
nm0136794,Lianella,Carell,05/06/1927,Italy,Lazio,0,1,"Lianella Carell was born on May 6, 1927 in Rome, Lazio, Italy. She was an actress and writer, known for"
nm2264184,Elissa,Knight,04/15/1975,USA,California,0,1,"Elissa Knight was born on April 15, 1975 in Santa Cruz, California, USA. She is known for her work on"
nm0041066,Antonella,Attili,04/03/1963,Italy,Lazio,0,1,"Antonella Attili was born on April 3, 1963 in Rome, Lazio, Italy. She is an actress and production manager, known for"
nm0000553,Liam,Neeson,06/07/1952,UK,Northern Ireland,0,0,"Liam Neeson was born on June 7, 1952 in Ballymena, Northern Ireland, to Katherine (Brown), a cook, and Bernard Neeson, a school caretaker. He was raised in a Catholic household. During his early years, Liam worked as a forklift operator for Guinness, a truck driver, an assistant architect and an amateur boxer. He had originally sought a career as a teacher by attending St. Mary's Teaching College, Newcastle. However, in 1976, Neeson joined the Belfast Lyric Players' Theater and made his professional acting debut in the play ""The Risen People"". After two years, Neeson moved to Dublin's Abbey Theater where he performed the classics. It was here that he was spotted by director"
nm0001001,James,Caan,03/26/1940,USA,New York,0,0,"A masculine and enigmatic actor whose life and movie career have had more ups and downs than the average rollercoaster and whose selection of roles has arguably derailed him from achieving true superstar status, James Caan is New York-born and bred."
nm0634159,Philippe,Noiret,10/01/1930,France,Nord,0,0,Philippe Noiret was one of French cinema's most familiar faces who appeared in more than 140 films in a career that spanned more than half a century.
nm0561158,Claire,Maurier,03/27/1929,France,Ceret,0,1,"Claire Maurier was born on March 27, 1929 in Ceret, France. She is an actress, known for"
nm0990547,Daniel,Mays,03/31/1978,UK,England,0,0,Daniel Alan Mays (born 31 March 1978) is an English actor.
nm0001695,George,Sanders,07/03/1906,Russian Empire [now Russia],St. Petersburg,0,0,"George Sanders was born of English parents in St. Petersburg, Russia. He worked in a Birmingham textile mill, in the tobacco business and as a writer in advertising. He entered show business in London as a chorus boy, going from there to cabaret, radio and theatrical understudy. His film debut, in 1936, was as Curly Randall in"
nm0000277,Richard,Attenborough,08/29/1923,UK,England,0,0,"Lord Richard Attenborough was born in Cambridge, England, the son of Mary (née Clegg), a founding member of the Marriage Guidance Council, and Frederick Levi Attenborough, a scholar and academic administrator who was a don at Emmanuel College and wrote a standard text on Anglo-Saxon law. The family later moved to Leicester where his father was appointed Principal of the university while Richard was educated at Wyggeston Grammar School for Boys in Leicester and at the Royal Academy of Dramatic Art (RADA)."
nm0383261,Chieko,Higashiyama,09/30/1890,Japan,Chiba,0,1,"Chieko Higashiyama was born on September 30, 1890 in Chiba, Japan. She was an actress, known for"
nm0618690,Matheus,Nachtergaele,01/03/1969,Brazil,São Paulo,0,0,"Matheus Nachtergaele was born in Sao Paulo, Brazil, in 1969. He is one of the best young Brazilian actor at the moment. He showed his talent in many beautiful roles, both in cinema and television. For the TV he workes in the TV series ""Hilda Furacao"" in the role of the transexual Cintura Fina, in the TV series ""A muralha"" in the role of a problematic and frantic Catholic priest in Brazil of 1600, in the beautiful and original novela ""Da cor do pecado"" in the role of a funny medium named Helinho. He also played in many beautiful and quality movies of the best Brazilian cinema of the late years, like, for example, the worldwide acclaimed ""Central Station"" by Walter Salles and ""City of God"" by Fernando Meirelles. He also worked in the beautiful movie ""Midnight"" by Walter Salles, and ""Four days in September"" by Bruno Barreto. Versatile and wonderful actor, he is able to play comic and dramatic roles with great talent and expressiveness. He also won twice the award of Best Actor in the Grande Prêmio Cinema Brasil (Great Award Brazilian Cinema), for his role in ""Midnight"" (1998) and ""O Auto da Compadecida"" (2000). He won the award of Best Actor for ""Amarelo Manga"", in XIII Cine Ceará (XIII Festival of Cinema of Ceará)in 2003"
