aid,fname,lname,birth_date,birth_country,birth_city,overall_rating,gender,description
nm0592135,Lin-Manuel,Miranda,01/16/1980,USA,New York,0,0,"Lin-Manuel Miranda wrote the first incarnation of ""In the Heights"" his sophomore year at Wesleyan University in Connecticut. Off-Broadway, ""In The Heights"" received nine Drama Desk nominations, including best music, best lyrics, and it won the award for outstanding ensemble performance; received the Lucille Lortel Award and Outer Critics Circle Award for best musical; received the Obie Award for outstanding music and lyrics; received a Theater World Award for outstanding debut Performance and the Clarence Derwent Award both for Mr. Miranda's performance. He is the recipient of the 2007 ASCAP Richard Rodgers New Horizons Award. He has appeared on"
nm0000204,Natalie,Portman,06/09/1981,Israel,Jerusalem,0,1,Natalie Portman is the first person born in the 1980s to have won the Academy Award for Best Actress (for
nm0000149,Jodie,Foster,11/19/1962,USA,California,0,1,Jodie Foster started her career at the age of two. For four years she made commercials and finally gave her debut as an actress in the TV series
nm0000235,Uma,Thurman,04/29/1970,USA,Massachusetts,0,1,"Uma Karuna Thurman was born in Boston, Massachusetts, into a highly unorthodox and internationally-minded family. She is the daughter of"
nm0001812,Lee,Van,01/09/1925,USA,New Jersey,0,0,"One of the great movie villains, Clarence Leroy Van Cleef, Jr. was born in Somerville, New Jersey, to Marion Lavinia (Van Fleet) and Clarence LeRoy Van Cleef, Sr. His parents were both of Dutch ancestry. Van Cleef started out as an accountant. He served in the U.S. Navy aboard minesweepers and sub chasers during World War II. After the war he worked as an office administrator, becoming involved in amateur theatrics in his spare time. An audition for a professional role led to a touring company job in ""Mr. Roberts"". His performance was seen by"
nm0000397,Corey,Feldman,07/16/1971,USA,California,0,0,"Corey Scott Feldman began his career at the age of three, starring in a Clio Award-winning McDonald's commercial and has sustained a 35-year career as a steadily working actor, with more than 80 films under his belt. Corey began his career in guest-starring roles on television series such as"
nm0000401,Laurence,Fishburne,07/30/1961,USA,Georgia,0,0,"Critically hailed for his forceful, militant, authoritative figures and one of Hollywood's most talented and versatile performers, Laurence (John) Fishburne III has been the recipient of numerous awards, including a number of NAACP Image honors."
nm0000531,Frances,McDormand,06/23/1957,USA,Illinois,0,1,"Frances Louise McDormand was born on June 23, 1957, in Gibson City, Illinois. She was adopted by Canadian-born parents Noreen Eloise (Nickleson), a nurse from Ontario, and Rev. Vernon Weir McDormand, a Disciples of Christ minister from Nova Scotia, who raised her in the suburbs of Pittsburgh. She earned a BA in theater from Bethany College in 1979 and an MFA from Yale University in 1982. Her career after graduation began onstage, and she has retained her association with the theater throughout her career. She soon obtained prominent roles in movies as well, first starring in"
nm1208167,Diane,Kruger,07/15/1976,West Germany,Lower Saxony,0,1,"Diane Kruger was born Diane Heidkrüger in Algermissen, near Hildesheim, Germany, to Maria-Theresa, a bank employee, and Hans-Heinrich Heidkrüger, a computer specialist. She studied ballet with the Royal Ballet in London before an injury ended her career. She returned to Germany and became a top fashion model. She later pursued acting and relocated to Paris at the suggestion of filmmaker"
nm0945522,Sô,Yamamura,02/24/1910,Japan,Tenri,0,0,"Sô Yamamura was born on February 24, 1910 in Tenri, Japan. He was an actor and director, known for"
nm0000889,Bonnie,Bedelia,03/25/1948,USA,New York,0,1,"The native New Yorker was born Bonnie Bedelia Culkin on March 25, 1948, the daughter of Phillip Harley Culkin, a journalist, and Marian Ethel Wagner Culkin, a writer and editor. Trained in ballet, her parents guided all of the children at one time or another into acting (which included"
nm1538116,Tisca,Chopra,01/01/1970,unknown,unknown,0,1,"Tisca is known for carefully choosing to be part of stories that needed to be brought to the people. With the burning desire to act, every endeavor of hers has been respected and applauded. Tisca has acted in over 50 feature films in different languages with many eminent directors like Aamir Khan, Prakash Jha, Sudhir Mishra, Abhinay Deo and others. As someone who's always refused to settle for the mediocre, Tisca's persistence and passion not only won her acclaim and fame, but also Two Filmfare Awards for a film she Wrote, Produced and Acted in, ""Chutney"". Taare Zameen Par, one of her sterling performances was Indian cinema's official entry to the League of Academy Awards. Another film where Tisca played a refugee, ""Qissa"" - Premiered at the Toronto Film Festival (TIFF) in 2013 and was featured in over 20 festivals. Tisca was nominated at the New York Indian Film Festival in the Best Actress category for her work in '10Ml Love', a film based on ""A Midsummer Night's Dream"". Her intense performance in the Indian adaptation of the American series - ""24"" - was much lauded and made her a household name. ""Hostages"", her debut on the Web is a runaway hit, endearing her even more to the audiences. ""Good Newwz"" where she played a key role as a doctor was also one of the biggest hits of the year 2020. Tisca has also acted in the Pulitzer Award winning play, ""Dinner with Friends"", which deals with the state of the modern marriage. She's been on the Jury of the prestigious MAMI Film Festival. Adding another feather to her illustrious hat, Tisca herself created a path to showcase the idea of rising above barriers through filmmaking. Each of her short films have been about breaking barriers - . ""Chutney"" breaks the 'thought barriers' where youth and beauty are prime parameters of how women are perceived . ""Chhuri"" breaks barriers about pre conceived notions of what an Indian Housewife should be like . ""Socha Na Tha"", was a film made at the time when everyone was getting depressed and didn't know how to go about filming, Tisca created this film by breaking barriers of old methods. This film was directed over the phone and created when everyone was in lockdown . ""Rubaru"" a short she has co-written, directed, acted in and produced, is in post production and close to Release in November 2020"
nm0052343,Subir,Banerjee,01/01/1970,unknown,unknown,0,0,"Subir Banerjee was 8 years old when he played the character of Apu in Satyajit Ray's classic 1955 film ""Pather Panchali"". On the 25th anniversary of the film, ""India Today"" reported in its article ""Pather Panchali: An Odyssey Revisited"", March 31, 1980, that Banerjee, then 33, had spent his adult career as a millhand at an engineering factory in the suburbs. In another follow-up, on July 3, 2006, ""India Today"" reported that Banerjee, then 60, had retired 5 years previously from his job as a ""provident fund officer"" at an engineering firm. ""India Today"" also reported that his wife Madhuri belatedly found out about his place in film history when they moved to the outskirts of Kolkata, either after his retirement or somewhat earlier in their marriage."
nm0598971,Yves,Montand,10/13/1921,Italy,Tuscany,0,0,"Yves Montand was born on October 13, 1921 in Monsummano Terme, Tuscany, Italy. He is known for his work on"
nm0000982,Josh,Brolin,02/12/1968,USA,California,0,0,"Rugged features and a natural charm have worked for Josh Brolin, the son of actor"
nm0000763,Dana,Andrews,01/01/1909,USA,Mississippi,0,0,"American leading man of the 1940s and 1950s, Dana Andrews was born Carver Dana Andrews on New Years Day 1909 on a farmstead outside Collins, Covington County, Mississippi. One of thirteen children, including fellow actor"
nm0410942,Yuriko,Ishida,10/03/1969,Japan,Tokyo,0,1,"Ishida Yuriko was born in Nagoya, Aichi Prefecture. Her family moved to Tokyo soon after. She travelled to and lived in Hyogo Prefecture, Kanagawa Prefecture and Taiwan as a child due to her father's work. During elementary school she participated in the Junior Olympics as a swimmer. She returned to Tokyo at age fifteen. She was scouted to model while at high school. She graduated from Kagawa Junior College's Institute Of Nutrition. She did a commercial for ANA for Okinawa in 1987. Her TV debut came in 1987 and she has been prolific since. She was in a TV serial called Umi No Gunsei ('Sea's Constellation') and movie Kanashi Iro Yanen ('Sad Colours') in 1988. She and her sister opened their own agency in 1999. She won the Japan Academy Awards prize for Best Supporting Actress for the film Kita No Zeronen in 2005. She is a writer and actress who has equal number of voice acting, serial and movies to her credit. Her sister is Ishida Hikari who is also an actress. She won the 91st Television Drama Academy Awards for Best Supporting Actress award for Nigeru Wa Haji Da Ga Yaku Ni Tatsu in 2016. Ishida maintain a short masculine haircut. She cites swimming, strolling, taking baths, writing and reading as favourite pastimes. Yuriko is a writer who has some eight books to her name. She has a dog and two cats as of 2017."
nm0705356,Daniel,Radcliffe,07/23/1989,UK,England,0,0,"Daniel Jacob Radcliffe was born on July 23, 1989 in Fulham, London, England, to casting agent"
nm0000134,Robert,De,08/17/1943,USA,New York,0,0,"One of the greatest actors of all time, Robert De Niro was born on August 17, 1943 in Manhattan, New York City, to artists Virginia (Admiral) and"
nm0000221,Charlie,Sheen,09/03/1965,USA,New York,0,0,"Charlie Sheen was born Carlos Irwin Estévez on September 3, 1965, in New York City. His father, actor"
nm0000582,Joe,Pesci,02/09/1943,USA,New Jersey,0,0,"Compact Italian-American actor Joe Pesci was born February 9, 1943 in Newark, New Jersey, to Mary (Mesce), a part-time barber, and Angelo Pesci, a bartender and forklift driver. Pesci first broke into entertainment as a child actor, and by the mid-1950s, was starring on the series ""Star Time Kids"". In the mid-1960s, he released a record under the stage name Joe Ritchie titled ""Little Joe Sure Can Sing"", and was also playing guitar with several bands, including"
nm0000006,Ingrid,Bergman,08/29/1915,Sweden,Stockholm,0,1,"Ingrid Bergman was one of the greatest actresses from Hollywood's lamented Golden Era. Her natural and unpretentious beauty and her immense acting talent made her one of the most celebrated figures in the history of American cinema. Bergman is also one of the most Oscar-awarded actresses, tied with"
nm0886870,Peter,van,07/16/1911,Poland],Zachodniopomorskie,0,0,"With his whitish blond crew-cut, slow, menacing drawl and Germanic manner, Van Eyck was destined to be typecast as stereotypically scowling, arrogant Nazi officers. This was ironic, because being an avowed anti-fascist, he had left Germany in 1931 -- two years before"
nm0534856,Madhavan, ,06/01/1970,India,Bihar,0,0,"Madhavan was born on June 1, 1970, in a Tamil-speaking family."
nm0000641,Gary,Sinise,03/17/1955,USA,Illinois,0,0,"Gary Alan Sinise was born in Blue Island, Illinois, to Mylles S. (Alsip) and"
nm0000230,Sylvester,Stallone,07/06/1946,USA,New York,0,0,"Sylvester Stallone is a athletically built, dark-haired American actor/screenwriter/director/producer, the movie fans worldwide have been flocking to see Stallone's films for over 40 years, making ""Sly"" one of Hollywood's biggest-ever box office draws."
nm0821041,Robert,Stack,01/13/1919,USA,California,0,0,"""Straight Shooting"" -- whether skeet shooting, or portraying"
nm0683253,Rosamund,Pike,01/01/1970,UK,England,0,1,"Born in 1979 in London, England, actress Rosamund Mary Elizabeth Pike is the only child of a classical violinist mother, Caroline (Friend), and an opera singer father, Julian Pike. Due to her parents' work, she spent her early childhood traveling around Europe. Pike attended Badminton School in Bristol, England and began acting at the National Youth Theatre. While appearing in a National Youth Theatre production of ""Romeo and Juliet"", she was first spotted and signed by an agent, although she continued her education at Wadham College, Oxford, where she read English Literature, eventually graduating with an upper second class honors degree."
nm12232673,Eser,Sariyar,01/01/1970,unknown,unknown,0,0,"Eser Sariyar was born in June 24, 2004 in Odense, Denmark. He is an programmer. Now he lives in Denmark and is still studying. Eser Sariyar is considered to be one of Denmarks&Turkey's best young entrepreneur and most respected programmers today. He is also involved in software development . He is known from MeetWeb."
nm9862860,Boluwatife,Treasure,01/01/1970,unknown,unknown,0,1,"Boluwatife Treasure Bankole is an actress, known for"
nm0000060,Gregory,Peck,04/05/1916,USA,California,0,0,"Eldred Gregory Peck was born on April 5, 1916 in La Jolla, California, to Bernice Mary (Ayres) and Gregory Pearl Peck, a chemist and druggist in San Diego. He had Irish (from his paternal grandmother), English, and some German, ancestry. His parents divorced when he was five years old. An only child, he was sent to live with his grandmother. He never felt he had a stable childhood. His fondest memories are of his grandmother taking him to the movies every week and of his dog, which followed him everywhere. He studied pre-med at UC-Berkeley and, while there, got bitten by the acting bug and decided to change the focus of his studies. He enrolled in the Neighborhood Playhouse in New York and debuted on Broadway after graduation. His debut was in"
nm1978402,Ha,Jung-woo,03/11/1978,March 11,unknown,0,0,"Jung-woo Ha is a South Korean actor, film director, screenwriter and film producer. His breakthrough to stardom came with the role in Na Hong-jin's serial killer film The Chaser (2008)."
nm0641939,Ryan,O'Neal,04/20/1941,USA,California,0,0,"Ryan O'Neal was born on April 20, 1941 in Los Angeles, California, USA. He is an actor and producer, known for"
nm1421814,Suriya, ,07/23/1975,India,Tamil Nadu,0,0,"Suriya was born to actor Sivakumar and his wife Lakshmi in Chennai, but brought up in Coimbatore. He is the eldest of three children; his younger brother is actor Karthi Sivakumar and he has a younger sister named Brindha Sivakumar. He attended PSBB School and St. Bede's School in Chennai and graduated from Loyola College with a Bachelor of Commerce degree."
nm0000174,Val,Kilmer,12/31/1959,USA,California,0,0,"Val Kilmer was born in Los Angeles, California, to Gladys Swanette (Ekstadt) and Eugene Dorris Kilmer, who was a real estate developer and aerospace equipment distributor. His mother, born in Indiana, was from a Swedish family, and his father was from Texas. Val studied at Hollywood's Professional's School and, in his teens, entered Juilliard's drama program. His professional acting career began on stage, and he still participates in theater; he played Hamlet at the 1988 Colorado Shakespeare Festival. His film debut was in the 1984 spoof"
nm0000018,Kirk,Douglas,12/09/1916,USA,New York,0,0,"Cleft-chinned, steely-eyed and virile star of international cinema who rose from being ""the ragman's son"" (the name of his best-selling 1988 autobiography) to become a bona fide superstar, Kirk Douglas, also known as Issur Danielovitch Demsky, was born on December 9, 1916 in Amsterdam, New York. His parents, Bryna (Sanglel) and Herschel Danielovitch, were Jewish immigrants from Chavusy, Mahilyow Voblast (now in Belarus). Although growing up in a poor ghetto, Douglas was a fine student and a keen athlete and wrestled competitively during his time at St. Lawrence University. Professional wrestling helped pay for his studies as did working on the side as a waiter and a bellboy. However, he soon identified an acting scholarship as a way out of his meager existence, and was sufficiently talented to gain entry into the American Academy of Dramatic Arts. He made his Broadway debut in ""Spring Again"" before his career was interrupted by World War II. He joining the United States Navy in 1941, and then after the end of hostilities in 1945, returned to the theater and some radio work. On the insistence of ex-classmate"
nm0001057,Toni,Collette,11/01/1972,Australia,New South Wales,0,1,"Toni Collette is an Academy Award-nominated Australian actress, best known for her roles in"
nm0001343,Carrie,Henn,05/07/1976,USA,Florida,0,1,"Carrie Henn was born on May 7, 1976 in Panama City, Florida, USA. She is an actress, known for"
nm0529543,Jean-Pierre,Léaud,05/28/1944,France,Paris,0,0,"Jean-Pierre Léaud is not everybody's cup of tea for sure, but will remain an important name in film history. As an actor he can be adored or hated for exactly the same reasons: he is one of those rare players that directors let improvise his dialogue, which gets on certain viewers' nerves while it fascinates others. The same is true for his very personal staccato diction and elocution and his many mannerisms, the most obvious one being his way to run his hand through his long hair. But there is no denying Léaud is not just another actor, whether you love him or are allergic to him. The son of actress Jacqueline Pierreux and scriptwriter/assistant director Pierre Léaud, Jean-Pierre started acting very early. Indeed, he was only thirteen when he first appeared on a screen, playing a small role in a swashbuckling film directed by veteran Georges Lampin ""la Tour, prends garde!"" (1957). And he was still only fourteen when he answered an ad placed in a newspaper by François Truffaut, who was seeking a young actor able to play Antoine Doinel, a troubled adolescent, in his first feature film ""The 400 blows"". Jean-Pierre was tested among a hundred other candidates and proved so amazingly spontaneous and so gifted for improvisation that not only was he hired but he would go on to play the role in four subsequent Truffaut semi-autobiographies concluding with ""Love on the run"" (1978), a unique experience indeed. Thanks to Truffaut he was introduced to the other stars of the French New Wave, mainly Jean-Luc Godard for whom he would appear in eight films and one TV film, and gradually became their icon. Not too sure about his acting talents, he planned to become a director (which he actually did only once) and worked as an assistant to Truffaut and Godard. But his success both as Truffaut's alter ego and as the leftist movie makers' spokesman encouraged him to go on playing rather than directing. ""Masculin Féminin"" (1966) by Godard even earned him an Award for Best Actor at the Berlin Film Festival. An ardent leftist militant himself, he worked with equally committed directors, including abroad. He was in Italian Pasolini's ""Porcile"" (1968), in Polish Skolimovski's ""Dialog 20-40-60"" (also '68) Brazilian Carlos Diegues' Os herdeiros (1970) and Glauber Rocha's Der Leone have sept cabeças (1971). Bertolucci also hired him for ""Last tango in Paris"" starring Marlon Brando (who so petrified Léaud that he could not play his scenes alongside him), but this one was filmed in Paris. This busy period ended after an excellent role in a classic art movie in the French style: Jean Eustache's ""La maman et la putain"". In the late seventies and throughout the eighties Léaud worked irregularly, mainly on television, occasionally giving a crazy performance in a mainstream film, as was the case in Josiane's Balasko crime comedy ""Les keufs"", for which he got a César nomination. But he made an exciting comeback in the nineties when several ""new New Wave"" directors hired Léaud to pay homage to their elders. Among them French movie makers such as Olivier Assayas, Danièle Dubroux , Serge Le Péron or Bertrand Bonello and foreigners like Finnish Aki Käurismäki and Taiwanese Tsai Ming-Liang. A second youth for eternally young, rebellious, ill-at-ease, annoyingly romantic,touchingly annoying Jean-Pierre Léaud, whose round face staring at the camera in the last shot of ""The 400 blows"" will never be forgotten."
nm0000843,Anne,Bancroft,09/17/1931,USA,New York,0,1,"Anne Bancroft was born on September 17, 1931 in The Bronx, NY, the middle daughter of Michael Italiano (1905-2001), a dress pattern maker, and Mildred DiNapoli (1907-2010), a telephone operator. She made her cinema debut in"
nm1542291,Christopher,Carley,05/31/1978,USA,New York,0,0,"He is best known for his Irish look with his natural red hair and slightly freckled skin. In 1996, he graduated from Pearl River High School in Pearl River, New York. In 1998, he took over the role of Ray in the Broadway production of The Beauty of Queen Leenane. He went on to play Second Bell Boy in the production of Once in a Lifetime. In 2005, he appeared in several Verizon Wireless commercials as Schmitty where his business-field character was tormented via cell phone by his friends and roommates."
nm1367246,Kang,Hye-jeong,01/04/1982,South Korea,unknown,0,1,"Kang Hye-jeong was born on January 4, 1982 in South Korea. She is an actress, known for"
nm0488917,Thomas,Bo,11/27/1963,Denmark,Gladsaxe,0,0,"Thomas Bo Larsen was born on November 27, 1963 in Gladsaxe, Denmark. He is known for his work on"
nm0000874,Steven,Bauer,12/02/1956,Cuba,Havana,0,0,"Steven Bauer was born on December 2, 1956 in Havana, Cuba. He is an actor and producer, known for"
nm0451148,Aamir,Khan,03/14/1965,India,Maharashtra,0,0,"Aamir Khan was born on March 14, 1965 in Mumbai. He is one of the most successful Indian Bollywood actors who is also known as ""Mr. Perfectionist of Bollywood"". With his recent successes in both the Indian and Chinese film markets, he has shouldered his way into becoming one of the world's biggest superstars. Undergoing rapid transformations in his body structure to better embody the variegated characters in his energetic films, Aamir has garnered praise from all parts of the globe. His most visible transformations can be seen in such movies as Lagaan (2001), Fanaa (2006), Taare Zameen Par (2007), Ghajini (2008), 3 idiots (2009), Talaash (2012), Dhoom 3 (2013), PK (2014), Dangal (2016) and Secret Superstar (2017). His recent successes with movies like Dangal, PK , Talaash and TV serial Satyamev Jayate have attracted attention from more serious moviegoing crowds. However, he is perhaps better known for his fabulous comedic roles, as exemplified by his iconic performances in cult comedies such as Andaz Apna Apna, Passion, and Dil Chahta Hai, to name a few. Aamir is also no slouch at TV commercial work."
nm0134073,Enzo,Cannavale,04/05/1928,Italy,Campania,0,0,"First of four brothers, he was discovered by Eduardo De Filippo when he was a post office clerk. In reality, according to the testimony of a former colleague still living, he was employed at the Military Hospital of Naples. Exponent of the Neapolitan theater, actor with ironic and comic verve, skilled character actor, he trod the stages together with Eduardo De Filippo and Aldo Giuffré."
nm0000494,Robert,Sean,02/28/1969,USA,New Jersey,0,0,"One actor who has deserved much acknowledgment and fame and has had to do without it on a number of occasions is Robert Sean Leonard, known by most as Dr. James Wilson on"
nm0004778,Adrien,Brody,04/14/1973,USA,New York,0,0,"Adrien Nicholas Brody was born in Woodhaven, Queens, New York, the only child of retired history professor Elliot Brody and Hungarian-born photographer"
nm0000092,John,Cleese,10/27/1939,UK,England,0,0,"John Cleese was born on October 27, 1939, in Weston-Super-Mare, England, to Muriel Evelyn (Cross) and Reginald Francis Cleese. He was born into a family of modest means, his father being an insurance salesman; but he was nonetheless sent off to private schools to obtain a good education. Here he was often tormented for his height, having reached a height of six feet by the age of twelve, and eventually discovered that being humorous could deflect aggressive behavior in others. He loved humor in and of itself, collected jokes, and, like many young Britons who would grow up to be comedians, was devoted to the radio comedy show, ""The Goon Show,"" starring the legendary"
nm0918334,Scott,Weinger,10/05/1975,USA,New York,0,0,"Scott Eric Weinger (pronounced wine-gur) was born in New York, New York, on October 5, 1975, to Babs Weinger, a teacher, and Elliott Weinger, an orthopedic surgeon. The eldest of four children, Scott has two brothers and one sister. He spent the majority of his formative years in southern Florida, then moved with his family to Los Angeles when his career began to take off."
nm1046097,Rachel,McAdams,11/17/1978,Canada,Ontario,0,1,"Rachel Anne McAdams was born on November 17, 1978 in London, Ontario, Canada, to Sandra Kay (Gale), a nurse, and Lance Frederick McAdams, a truck driver and furniture mover. She is of English, Welsh, Irish, and Scottish descent. Rachel became involved with acting as a teenager and by the age of 13 was performing in Shakespearean productions in summer theater camp; she went on to graduate with honors with a BFA degree in Theater from York University. After her debut in an episode of Disney's"
nm0001538,Jonny,Lee,11/15/1972,UK,England,0,0,"Jonny (sometimes credited as Johnny) Lee Miller was born on November 15, 1972, in Kingston, England, UK. He is the son of actors Anna Lee and"
nm0000201,Michelle,Pfeiffer,04/29/1958,USA,California,0,1,
nm0000304,Linda,Blair,01/22/1959,USA,Missouri,0,1,"From the age of five, Linda Blair had to get used to the spotlight, first as a child model and then as an actress, when out of 600 applicants she was picked for the role of Regan, the possessed child, in"
nm0484737,Inge,Landgut,11/23/1922,Germany,Berlin,0,1,"Inge Landgut was born on November 23, 1922 in Berlin, Germany. She is known for her work on"
