aid,fname,lname,birth_date,birth_country,birth_city,overall_rating,gender,description
nm0001971,Ewen,Bremner,01/23/1972,UK,Scotland,0,0,"Born in Edinburgh, Scotland, Ewen Bremner has worked with many of the most respected directors in world cinema, including Danny Boyle, Mike Leigh, Ridley Scott, Joon-Ho Bong, Werner Herzog and Woody Allen. Ewen has established himself by creating unique characters in critically acclaimed films, as well as going toe to toe with many of Hollywood's biggest stars."
nm0001221,Louise,Fletcher,07/22/1934,USA,Alabama,0,1,"Born in Birmingham, Alabama, to Episcopal minister Robert Fletcher and his wife Estelle, both of whom were deaf, Louise Fletcher was introduced to performing at a young age by the aunt who taught her to speak. After graduating from the University of North Carolina, she took a trip out west with her roommates, finding herself in Los Angeles without enough money to return home. She took a temporary job as a receptionist and signed up for acting classes at night. Soon she was working regularly in television and film, but after marrying producer"
nm0003817,Michael,Clarke,12/10/1957,USA,Illinois,0,0,"Michael Clarke Duncan was born on December 10, 1957 in Chicago, Illinois. Raised by his single mother, Jean, a house cleaner, on Chicago's South Side, Duncan grew up resisting drugs and alcohol, instead concentrating on school. He wanted to play football in high school, but his mother wouldn't let him, afraid that he would get hurt. He then turned to acting, dreaming of becoming a famous actor."
nm0000197,Jack,Nicholson,04/22/1937,USA,New Jersey,0,0,"Jack Nicholson, an American actor, producer, director and screenwriter, is a three-time Academy Award winner and twelve-time nominee. Nicholson is also notable for being one of two actors - the other being"
nm4299147,Sareh,Bayat,10/06/1979,Iran,Tehran,0,1,"Sareh Bayat was born and raised in Tehran, Iran. She majored in Theater at university and received a Diploma of Honor for Best Actress from Tehran's Police Theatre Festival in 2006. She furthered her acting training at Karnameh Institute of Arts and Culture's School of Cinematic Arts where she received lessons by renowned actor,"
nm2395586,Christopher,Mintz-Plasse,06/20/1989,USA,California,0,0,"Christopher Mintz-Plasse is an American actor, drummer and comedian who is widely known for playing McLovin from the hit high school comedy film Superbad. He also played Fishlegs from How to Train Your Dragon, Augie Farcques from Role Models, Giuseppe from Marmaduke, Chris D'Amico from Kick-Ass, King Gristle from Trolls and Scoonie Schofield from Neighbors."
nm0001567,Connie,Nielsen,07/03/1965,Denmark,Frederikshavn,0,1,"Danish beauty Connie Nielsen consistently lights up the screen with an eclectic bevy of film roles. She was born in Frederikshavn, Denmark, to a mother who worked as an insurance clerk, and a father, Bent Nielsen, who was a bus driver. Nielsen began her acting career working alongside her mother on the local revue and variety scene. At 18, she headed to Paris to continue her pursuit of acting, which led her to further work and study in Rome and Milan. In addition to being an accomplished actress, Nielsen is also a trained singer, dancer and is fluent in English, German, Danish, Swedish, French and Italian. She resides in New York."
nm0001416,Catherine,Keener,03/23/1959,USA,Florida,0,1,"Catherine Keener is an American actress, Oscar-nominated for her roles in the independent films"
nm0618057,Ulrich,Mühe,06/20/1953,East Germany,Grimma,0,0,"Ulrich Mühe was born on June 20, 1953 in Grimma, East Germany. He was an actor and director, known for"
nm0386472,Emile,Hirsch,03/13/1985,USA,California,0,0,"Emile Davenport Hirsch was born in Palms, California, to Margaret Esther (Davenport), a teacher and visual artist, and David M. Hirsch, an entrepreneur and producer. He grew up in Los Angeles and Santa Fe, New Mexico, and having been introduced to acting while still at school, he got his first acting job on TV at the age of 11 in an episode of"
nm0000643,Tom,Skerritt,08/25/1933,USA,Michigan,0,0,"Lean, ruggedly handsome leading man and supporting actor whose ""outdoor"" looks have improved with age, Tom Skerritt attended Wayne State University and UCLA. He was first noticed in a UCLA production of ""The Rainmaker"" before making his movie debut in"
nm0368689,Leila,Hatami,10/01/1972,Iran,Tehran,0,1,"Award-winning actress, Leila Hatami, was born on October 1, 1972 in Tehran, Iran, to legendary Iranian Director,"
nm0000493,Jack,Lemmon,02/08/1925,USA,Massachusetts,0,0,"Jack Lemmon was born in Newton, Massachusetts, to Mildred Lankford Noel and John Uhler Lemmon, Jr., the president of a doughnut company. His ancestry included Irish (from his paternal grandmother) and English. Jack attended Ward Elementary near his Newton, MA home. At age 9 he was sent to Rivers Country Day School, then located in nearby Brookline. After RCDS, he went to high school at Phillips Andover Academy. Jack was a member of the Harvard class of 1947, where he was in Navy ROTC and the Dramatic Club. After service as a Navy ensign, he worked in a beer hall (playing piano), on radio, off Broadway, TV and Broadway. His movie debut was with"
nm0701012,Edna,Purviance,10/21/1895,USA,Nevada,0,1,Edna Purviance began working as a stenographer in San Francisco.
nm0000332,Don,Cheadle,11/29/1964,USA,Missouri,0,0,"Donald Frank Cheadle was born in Kansas City, Missouri, on November 29, 1964. His childhood found him moving from city to city with his family: mother Bettye (née North), a teacher; father Donald Frank Cheadle Sr., a clinical psychologist; sister Cindy; and brother Colin. After graduating from high school in Denver, Colorado, Cheadle attended and graduated from the California Institute of the Arts with a bachelor¹s degree in fine arts. Encouraged by his college friends, he attended a variety of auditions and landed a recurring role on the hit series"
nm4271336,Shameik,Moore,05/04/1995,USA,Georgia,0,0,"Born in Atlanta of Jamaican descent, Shameik Moore booked his first lead role of Malcolm in"
nm0437520,Nobuo,Kaneko,03/27/1923,March 27,unknown,0,0,"Nobuo Kaneko was born on March 27, 1923. He was an actor, known for"
nm0001590,Chazz,Palminteri,05/15/1952,USA,New York,0,0,Bronx-born and raised Chazz Palminteri was a natural choice to continue the Italianate torch in film. In the tradition set forth in the 1970s by such icons as director
nm0000353,Willem,Dafoe,07/22/1955,USA,Wisconsin,0,0,"Having made over one hundred films in his legendary career, Willem Dafoe is internationally respected for bringing versatility, boldness, and daring to some of the most iconic films of our time. His artistic curiosity in exploring the human condition leads him to projects all over the world, large and small, Hollywood films as well as Independent cinema."
nm0559444,Yôji,Matsuda,10/19/1967,Japan,Fukuoka,0,0,"Yôji Matsuda was born on October 19, 1967 in Fukuoka, Japan. He is an actor, known for"
nm0001735,Talia,Shire,04/25/1946,USA,New York,0,1,"Talia Shire was born on April 25, 1946 in Lake Success, Long Island, New York, USA. She is an actress and producer, known for"
nm0001421,George,Kennedy,02/18/1925,USA,New York,0,0,"George Harris Kennedy, Jr. was born on February 18, 1925 in New York City, to Helen A. (Kieselbach), a ballet dancer, and George Harris Kennedy, an orchestra leader and musician. Following high school graduation, Kennedy enlisted in the United States Army in 1943 with the hope to become a fighter pilot in the Army Air Corps. Instead, he wound up in the infantry, served under General George S. Patton and distinguished himself with valor. He won two Bronze Stars and four rows of combat and service ribbons."
nm0001691,Geoffrey,Rush,07/06/1951,Australia,Queensland,0,0,"Geoffrey Roy Rush was born on July 6, 1951, in Toowoomba, Queensland, Australia, to Merle (Bischof), a department store sales assistant, and Roy Baden Rush, an accountant for the Royal Australian Air Force. His mother was of German descent and his father had English, Irish, and Scottish ancestry. He was raised in Brisbane, Queensland, after his parents split up."
nm0001589,Michael,Palin,05/05/1943,UK,England,0,0,
nm0000521,Sophie,Marceau,11/17/1966,France,Paris,0,1,"Sophie Marceau was born Sophie Danièle Sylvie Maupu in Paris, France, to Simone (Morisset), a shop assistant, and Benoît Maupu, a truck driver. She grew up far from the studio spotlights. When she was 14 she was living in the Paris suburb of Gentilly with her father. She learned from friends that director"
nm0534045,Fred,MacMurray,08/30/1908,USA,Illinois,0,0,"Fred MacMurray was likely the most underrated actor of his generation. True, his earliest work is mostly dismissed as pedestrian, but no other actor working in the 1940s and 50s was able to score so supremely whenever cast against type."
nm0000150,Michael,J.,06/09/1961,Canada,Alberta,0,0,"Michael J. Fox was born Michael Andrew Fox on June 9, 1961 in Edmonton, Alberta, Canada, to"
nm0002011,Lee,J.,12/08/1911,USA,New York,0,0,"Lee J. Cobb, one of the premier character actors in American film for three decades in the post-World War II period, was born Leo Jacoby in New York City's Lower East Side on December 8, 1911. The son of a Jewish newspaper editor, young Leo was a child prodigy in music, mastering the violin and the harmonica. Any hopes of a career as a violin virtuoso were dashed when he broke his wrist, but his talent on the harmonica may have brought him his first professional success. At the age of 16 or 17 he ran away from home to Hollywood to try to break into motion pictures as an actor. He reportedly made his film debut as a member of"
nm1297015,Emma,Stone,11/06/1988,USA,Arizona,0,1,"Emily Jean ""Emma"" Stone was born on November 6, 1988 in Scottsdale, Arizona to Krista Jean Stone (née Yeager), a homemaker & Jeffrey Charles ""Jeff"" Stone, a contracting company founder and CEO. She is of Swedish, German & British Isles descent. Stone began acting as a child as a member of the Valley Youth Theatre in Phoenix, Arizona, where she made her stage debut in a production of"
nm0000799,Edward,Asner,11/15/1929,USA,Missouri,0,0,"Edward Asner was born of Russian Jewish parentage in Kansas City, to Morris David Asner (founder and owner of the Kansas City-based Asner Iron & Metal Company) and his wife Elizabeth ""Lizzie"" (Seliger). After attending college, Ed worked various jobs, including in a steel mill, as a door-to-door salesman and on an assembly line for General Motors. Between 1947 and 1949, he attended the University of Chicago. The onset of the Korean War saw him drafted into the U.S. Army Signals Corps and posted to France where he was primarily assigned clerical tasks. Upon demobilization, Asner joined the Playwrights Theatre Company in Chicago but soon progressed to New York. In 1955, he appeared off-Broadway in the leading role of the beggar king Jonathan Peachum in Brecht's Threepenny Opera. Five years later, he made his debut on the Great White Way in the courtroom drama Face of a Hero, co-starring alongside"
nm0487884,Alexandra,Maria,11/12/1978,Romania,Bucharest,0,1,"Born on 12 November 1978 in Bucharest, Romania,"
nm0000614,Alan,Rickman,02/21/1946,UK,England,0,0,"Alan Rickman was born on a council estate in Acton, West London, to Margaret Doreen Rose (Bartlett), of English and Welsh descent, and Bernard Rickman, of Irish descent, who worked at a factory. Alan Rickman had an older brother (David), a younger brother (Michael), and a younger sister (Sheila). When Alan was 8 years old, his father died. He attended Latymer Upper School on a scholarship. He studied Graphic Design at Chelsea College of Art and Design, where he met Rima Horton, who would later become his longtime partner."
nm0000051,James,Mason,05/15/1909,UK,England,0,0,"James Mason was born in Huddersfield and had a film career spanning over 50 years during which he appeared in over 100 films in England and America but never won an Oscar. Whatever role he played, from the wounded Belfast gunman in Odd Man Out to Rommel in The Desert Fox, his creamy velvet voice gave him away. Like Charlie Chaplin James left the screen to spend his later life living in Switzerland. His first marriage had been to Pamela Kellino, a Yorkshire mill owner's daughter and his second to Australian actress Clarissa Kaye."
nm0396558,Nicholas,Hoult,12/07/1989,UK,England,0,0,"Nicholas Hoult was born on December 7, 1989 in Wokingham, Berkshire, England, UK as Nicholas Caradoc Hoult. His parents are"
nm0949350,Burt,Young,04/30/1940,USA,New York,0,0,"Burly, talented character actor who has remained consistently busy playing ""rough at the edge"" type characters, often on the wrong side of the law. Young was born on April 30 1940 in New York City, the son of a high school shop teacher. He is of Italian descent. Young received his dramatic arts training under legendary acting coach"
nm0880521,Liv,Ullmann,12/16/1938,Japan,Tokyo,0,1,"Liv Ullmann's father was a Norwegian engineer who used to work abroad, so as a child she lived in Tokyo, Canada, New York and Oslo. In the mid-'50s she made her stage debut and in 1957 made her film debut. She really became successful, however, when she began to work for Swedish director"
nm0350453,Jake,Gyllenhaal,12/19/1980,USA,California,0,0,"Jacob Benjamin Gyllenhaal was born in Los Angeles, California, to producer/screenwriter"
nm5038871,Annika,Wedderkopp,12/14/2004,Denmark,Sjælland,0,1,"Annika Wedderkopp was born on December 14, 2004 in Gentofte, Sjælland, Denmark. She is an actress, known for"
nm0000128,Russell,Crowe,04/07/1964,New Zealand,Wellington,0,0,"Russell Ira Crowe was born in Wellington, New Zealand, to Jocelyn Yvonne (Wemyss) and John Alexander Crowe, both of whom catered movie sets. His maternal grandfather, Stanley Wemyss, was a cinematographer. Crowe's recent ancestry includes Welsh (where his paternal grandfather was born, in Wrexham), English, Irish, Scottish, Norwegian, Swedish, Italian, and Maori (one of Crowe's maternal great-grandmothers, Erana Putiputi Hayes Heihi, was Maori)."
nm0001426,Ben,Kingsley,12/31/1943,UK,England,0,0,"Ben Kingsley was born Krishna Bhanji on December 31, 1943 in Scarborough, Yorkshire, England. His father, Rahimtulla Harji Bhanji, was a Kenyan-born medical doctor, of Gujarati Indian descent, and his mother, Anna Lyna Mary (Goodman), was an English actress. Ben began to act in stage plays during the 1960s. He soon became a successful stage actor, and also began to have roles in films and television. His birth name was Krishna Bhanji, but he changed his name to ""Ben Kingsley"" soon after gaining fame as a stage actor, fearing that a foreign name could hamper his acting career."
nm0813272,Yuriy,Solomin,06/18/1935,Russia],USSR [now Zabaykalsky Krai,0,0,"Yuri Solomin is an acclaimed Russian stage and film actor and director, internationally best known for his work with director"
nm0000564,Peter,O'Toole,08/02/1932,UK,England,0,0,"A leading man of prodigious talents,"
nm0000199,Al,Pacino,04/25/1940,USA,New York,0,0,"Alfredo James ""Al"" 'Pacino established himself as a film actor during one of cinema's most vibrant decades, the 1970s, and has become an enduring and iconic figure in the world of American movies."
nm5645519,Anthony,Gonzalez,09/23/2004,USA,California,0,0,"Anthony Gonzalez was born on September 23, 2004 in Los Angeles, California, USA. He is an actor, known for"
nm0272581,Rebecca,Ferguson,10/19/1983,Sweden,unknown,0,1,"Rebecca Ferguson was born Rebecca Louisa Ferguson Sundström in Stockholm, Sweden, and grew up in its Vasastaden district. Her father is Swedish. Her mother, Rosemary Ferguson, is British, of Scottish and Northern Irish descent, and moved to Sweden at the age of 25. Rebecca attended an English-speaking school in Sweden and was raised bilingual, speaking Swedish and English. As a student, she attended the Adolf Fredrik's Music School in Stockholm and graduated in 1999."
nm0404158,Walter,Huston,04/05/1883,Canada,Ontario,0,0,"For many years Walter Huston had two passions: his career as an engineer and his vocation for the stage. In 1909 he dedicated himself to the theatre, and made his debut on Broadway in 1924. In 1929 he journeyed to Hollywood, where his talent and ability made him one of the most respected actors in the industry. He won a Best Supporting Actor Academy Award for"
nm0744834,Eli,Roth,04/18/1972,USA,Massachusetts,0,0,"Eli Raphael Roth was born in Newton, Massachusetts, to Cora (Bialis), a painter, and Sheldon H. Roth, a psychoanalyst, psychiatrist, and clinical professor. His family is Jewish (from Austria, Hungary, Russia, and Poland). He began shooting Super 8 films at the age of eight; after watching Ridley Scott's"
nm0352835,Brahim,Hadjadj,01/01/1970,unknown,unknown,0,0,"Brahim Hadjadj is an actor, known for"
nm0004486,Bruno,Ganz,03/22/1941,Switzerland,Zürich-Seebach,0,0,Bruno Ganz was an acclaimed Swiss actor who was a prominent figure in German language film and television for over fifty years. He is internationally renowned for portraying Adolf Hitler in the Academy Award-nominated film Downfall (2004).
nm0188949,Alison,Crosbie,01/01/1970,unknown,unknown,0,,Alison Crosbie is known for her work on
nm0001479,Carole,Lombard,10/06/1908,USA,Indiana,0,1,"Carole Lombard was born Jane Alice Peters in Fort Wayne, Indiana, on October 6, 1908. Her parents divorced in 1916 and her mother took the family on a trip out West. While there they decided to settle down in the Los Angeles area. After being spotted playing baseball in the street with the neighborhood boys by a film director, Carole was signed to a one-picture contract in 1921 when she was 12. The film in question was"
nm0579663,Adolphe,Menjou,02/18/1890,USA,Pennsylvania,0,0,"The words ""suave"" and ""debonair"" became synonymous with the name Adolphe Menjou in Hollywood, both on- and off-camera. The epitome of knavish, continental charm and sartorial opulence, Menjou, complete with trademark waxy black mustache, evolved into one of Hollywood's most distinguished of artists and fashion plates, a tailor-made scene-stealer, if you will. What is often forgotten is that he was primed as a matinée idol back in the silent-film days. With hooded, slightly owlish eyes, a prominent nose and prematurely receding hairline, he was hardly competition for"
nm0754272,Yacef,Saadi,01/20/1928,France [now Algeria],Alger,0,0,"Yacef Saadi was born on January 20, 1928 in Algiers, Alger, France [now Algeria]. He is known for his work on"
nm0000912,Jack,Benny,02/14/1894,USA,Illinois,0,0,"The son of a saloon keeper, Jack Benny (born Benny Kubelsky) began to study the violin at the age six, and his ""ineptness"" at it, would later become his trademark (in reality, he was a very accomplished player). When given the opportunity to play in live theatre professionally, Benny quit school and joined vaudeville. In the same theatre that Benny was working with were the very young"
nm1055413,Michael,Fassbender,04/02/1977,West Germany,Baden-Württemberg,0,0,"Michael Fassbender is an Irish actor who was born in Heidelberg, Germany, to a German father, Josef, and an Irish mother, Adele (originally from Larne, County Antrim, in Northern Ireland). Michael was raised in the town of Killarney, Co. Kerry, in south-west Ireland, where his family moved to when he was two years old. His parents ran a restaurant (his father is a chef)."
nm0000164,Anthony,Hopkins,12/31/1937,UK,Wales,0,0,"Anthony Hopkins was born on December 31, 1937, in Margam, Wales, to Muriel Anne (Yeats) and Richard Arthur Hopkins, a baker. His parents were both of half Welsh and half English descent. Influenced by"
nm0000190,Matthew,McConaughey,11/04/1969,USA,Texas,0,0,"American actor and producer Matthew David McConaughey was born in Uvalde, Texas. His mother, Mary Kathleen (McCabe), is a substitute school teacher originally from New Jersey. His father, James Donald McConaughey, was a Mississippi-born gas station owner who ran an oil pipe supply business. He is of Irish, Scottish, German, English, and Swedish descent. Matthew grew up in Longview, Texas, where he graduated from the local High School (1988). Showing little interest in his father's oil business, which his two brothers later joined, Matthew was longing for a change of scenery, and spent a year in Australia, washing dishes and shoveling chicken manure. Back to the States, he attended the University of Texas in Austin, originally wishing to be a lawyer. But, when he discovered an inspirational Og Mandino book ""The Greatest Salesman in the World"" before one of his final exams, he suddenly knew he had to change his major from law to film."
nm0515950,Danny,Lloyd,10/13/1972,USA,Illinois,0,0,Danny Lloyd was selected for the role of Danny Torrance in
nm1179105,Alexandre,Rodrigues,05/21/1983,Brazil,Rio de Janeiro,0,0,"Alexandre Rodrigues was born on May 21, 1983 in Rio de Janeiro, Rio de Janeiro, Brazil. He is an actor, known for"
nm0000313,Jeff,Bridges,12/04/1949,USA,California,0,0,"Jeffrey Leon Bridges was born on December 4, 1949 in Los Angeles, California, the son of well-known film and TV star"
nm0000602,Robert,Redford,08/18/1936,USA,California,0,0,"Born on August 18, 1936, in Santa Monica, California, to Charles Robert Redford, an accountant for Standard Oil, and Martha Redford, who died in 1955, the year he graduated high school, Charles Robert Redford Jr. was a scrappy kid who stole hubcaps in high school and lost his college baseball scholarship at the University of Colorado because of drunkenness. After studying at the Pratt Institute of Art and living the painter's life in Europe, he studied acting in New York at the American Academy of Dramatic Arts."
nm0002134,Paul,Henreid,01/10/1908,Italy],Friuli-Venezia Giulia,0,0,"Paul Henreid was born Paul Georg Julius Freiherr von Hernreid Ritter von Wasel-Waldingau in Trieste, in the Austro-Hungarian Empire. He was the son of Marie Luise Heilig (Lendecke) and Baron Karl Alphons Hernreid. His father was an aristocratic banker, who was born to a Jewish family whose surname was changed from Hirsch to Hernreid."
nm0005458,Jason,Statham,07/26/1967,UK,England,0,0,"Jason Statham was born in Shirebrook, Derbyshire, to Eileen (Yates), a dancer, and Barry Statham, a street merchant and lounge singer. He was a Diver on the British National Diving Team and finished twelfth in the World Championships in 1992. He has also been a fashion model, black market salesman and finally of course, actor. He received the audition for his debut role as Bacon in"
nm0000017,Marlene,Dietrich,12/27/1901,Germany],German Empire [now part of Berlin,0,1,"Her father was a police lieutenant and imbued in her a military attitude to life. Marlene was known in school for her ""bedroom eyes"" and her first affairs were at this stage in her life - a professor at the school was terminated. She entered the cabaret scene in 1920s Germany, first as a spectator then as a cabaret singer. In 1923, she married and, although she and"
nm0001618,Joaquin,Phoenix,10/28/1974,Puerto Rico,San Juan,0,0,"Joaquin Phoenix was born Joaquin Rafael Bottom in San Juan, Puerto Rico, to Arlyn (Dunetz) and John Bottom, and is the middle child in a brood of five. His parents, from the continental United States, were then serving as Children of God missionaries. His mother is from a Jewish family from New York, while his father, from California, is of mostly British Isles descent. As a youngster, Joaquin took his cues from older siblings"
nm0001485,Myrna,Loy,08/02/1905,USA,Montana,0,1,"Myrna Williams, later to become Myrna Loy, was born on August 2, 1905 in Helena, Montana. Her father was the youngest person ever elected to the Montana State legislature. Later on her family moved to Radersburg where she spent her youth on a cattle ranch. At the age of 13, Myrna's father died of influenza and the rest of the family moved to Los Angeles. She was educated in L.A. at the Westlake School for Girls where she caught the acting bug. She started at the age of 15 when she appeared in local stage productions in order to help support her family. Some of the stage plays were held in the now famous Grauman's Theater in Hollywood. Mrs. Rudolph Valentino happened to be in the audience one night who managed to pull some strings to get Myrna some parts in the motion picture industry. Her first film was a small part in the production of"
nm0000027,Alec,Guinness,04/02/1914,UK,England,0,0,Alec Guinness was an English actor. He is known for his six collaborations with
nm0000267,Julie,Andrews,10/01/1935,UK,England,0,1,"Julia Elizabeth Wells was born on October 1, 1935, in England. Her mother, Barbara Ward (Morris), and stepfather, both vaudeville performers, discovered her freakish but undeniably lovely four-octave singing voice and immediately got her a singing career. She performed in music halls throughout her childhood and teens, and at age 20, she launched her stage career in a London Palladium production of ""Cinderella""."
nm0005251,Carrie-Anne,Moss,08/21/1967,Canada,British Columbia,0,1,"Carrie-Anne Moss was born and raised in Vancouver, Canada. At age 20, after studying at the American Academy of Dramatic Arts, she moved to Europe to pursue a career in modeling. While in Spain she was cast in the TV show Dark Justice which was produced in Barcelona for its first season and Los Angeles for its second. Once in LA, Carrie-Anne was cast in other series regular opportunities like Matrix (which coincidentally presaged the movie that would later make her famous), and then Aaron Spelling's Models Inc."
nm0074788,Henry,Bergman,02/23/1868,USA,California,0,0,"Henry Bergman was born on February 23, 1868 in San Francisco, California, USA. He was an actor and assistant director, known for"
