mid,name,mpaa,description,release_date,overall_rating
tt0089881,Ran,R,"In Medieval Japan, an elderly warlord retires, handing over his empire to his three sons. However, he vastly underestimates how the new-found power will corrupt them and cause them to turn on each other...and him.",1985-06-01,0
tt0120382,The Truman Show,PG,An insurance salesman discovers his whole life is actually a reality TV show.,1998-06-05,0
tt0112641,Casino,R,"A tale of greed, deception, money, power, and murder occur between two best friends: a mafia enforcer and a casino executive compete against each other over a gambling empire, and over a fast-living and fast-loving socialite.",1995-11-22,0
tt0105695,Unforgiven,R,"Retired Old West gunslinger William Munny reluctantly takes on one last job, with the help of his old partner Ned Logan and a young man, The 'Schofield Kid.'",1992-08-07,0
tt0055031,Judgment at Nuremberg,Approved,"In 1948, an American court in occupied Germany tries four Nazis judged for war crimes.",1961-12-18,0
tt0457430,Pan's Labyrinth,R,"In the Falangist Spain of 1944, the bookish young stepdaughter of a sadistic army officer escapes into an eerie but captivating fantasy world.",2007-01-19,0
tt102723x,The Father,PG-13,"A man refuses all assistance from his daughter as he ages. As he tries to make sense of his changing circumstances, he begins to doubt his loved ones, his own mind and even the fabric of his reality.",2021-02-26,0
tt0993846,The Wolf of Wall Street,R,"Based on the true story of Jordan Belfort, from his rise to a wealthy stock-broker living the high life to his fall involving crime, corruption and the federal government.",2013-12-25,0
tt0042192,All About Eve,Passed,A seemingly timid but secretly ruthless ingénue insinuates herself into the lives of an aging Broadway star and her circle of theater friends.,1950-10-27,0
tt0363163,Downfall,R,"Traudl Junge, the final secretary for Adolf Hitler, tells of the Nazi dictator's final days in his Berlin bunker at the end of WWII.",2005-04-08,0
tt6966692,Green Book,PG-13,A working-class Italian-American bouncer becomes the driver of an African-American classical pianist on a tour of venues through the 1960s American South.,2018-11-16,0
tt0053291,Some Like It Hot,Passed,"After two male musicians witness a mob hit, they flee the state in an all-female band disguised as women, but further complications set in.",1959-03-19,0
tt0012349,The Kid,Passed,"The Tramp cares for an abandoned child, but events put that relationship in jeopardy.",1921-02-06,0
tt5074352,Dangal,Not Rated,Former wrestler Mahavir Singh Phogat and his two wrestler daughters struggle towards glory at the Commonwealth Games in the face of societal oppression.,2016-12-21,0
tt1255953,Incendies,R,Twins journey to the Middle East to discover their family history and fulfill their mother's last wishes.,2011-01-12,0
tt0017136,Metropolis,Not Rated,"In a futuristic city sharply divided between the working class and the city planners, the son of the city's mastermind falls in love with a working-class prophet who predicts the coming of a savior to mediate their differences.",1927-03-13,0
tt1832382,A Separation,PG-13,A married couple are faced with a difficult decision - to improve the life of their child by moving to another country or to stay in Iran and look after a deteriorating parent who has Alzheimer's disease.,2011-03-16,0
tt0986264,Like Stars on Earth,PG,"An eight-year-old boy is thought to be a lazy trouble-maker, until the new art teacher has the patience and compassion to discover the real problem behind his struggles in school.",2007-12-21,0
tt0372784,Batman Begins,PG-13,"After training with his mentor, Batman begins his fight to free crime-ridden Gotham City from corruption.",2005-06-15,0
tt8579674,1917,R,"April 6th, 1917. As an infantry battalion assembles to wage war deep in enemy territory, two soldiers are assigned to race against time and deliver a message that will stop 1,600 men from walking straight into a deadly trap.",2020-01-10,0
tt0059578,For a Few Dollars More,R,Two bounty hunters with the same intentions team up to track down an escaped Mexican outlaw.,1967-05-10,0
tt0040522,Bicycle Thieves,Not Rated,"In post-war Italy, a working-class man's bicycle is stolen, endangering his efforts to find work. He and his son set out to find it.",1949-12-13,0
tt0097576,Indiana Jones and the Last Crusade,PG-13,"In 1938, after his father Professor Henry Jones, Sr. goes missing while pursuing the Holy Grail, Professor Henry 'Indiana' Jones, Jr. finds himself up against Adolf Hitler's Nazis again to stop them from obtaining its powers.",1989-05-24,0
tt0208092,Snatch,R,"Unscrupulous boxing promoters, violent bookmakers, a Russian gangster, incompetent amateur robbers and supposedly Jewish jewelers fight to track down a priceless stolen diamond.",2001-01-19,0
tt0044741,Ikiru,Not Rated,A bureaucrat tries to find meaning in his life after he discovers he has terminal cancer.,1956-03-25,0
tt0095016,Die Hard,R,An NYPD officer tries to save his wife and several others taken hostage by German terrorists during a Christmas party at the Nakatomi Plaza in Los Angeles.,1988-07-20,0
tt0113277,Heat,R,A group of high-end professional thieves start to feel the heat from the LAPD when they unknowingly leave a clue at their latest heist.,1995-12-15,0
tt0056592,To Kill a Mockingbird,Approved,"Atticus Finch, a widowed lawyer in Depression-era Alabama, defends a black man against an undeserved rape charge, and his children against prejudice.",1963-03-16,0
tt8503618,Hamilton,PG-13,"The real life of one of America's foremost founding fathers and first Secretary of the Treasury, Alexander Hamilton. Captured live on Broadway from the Richard Rodgers Theater with the original Broadway cast.",2020-07-03,0
tt1049413,Up,PG,"78-year-old Carl Fredricksen travels to Paradise Falls in his house equipped with balloons, inadvertently taking a young stowaway.",2009-05-29,0
tt0075314,Taxi Driver,R,"A mentally unstable veteran works as a nighttime taxi driver in New York City, where the perceived decadence and sleaze fuels his urge for violent action.",1976-02-09,0
tt0070735,The Sting,PG,Two grifters team up to pull off the ultimate con.,1973-12-25,0
tt0091251,Come and See,Not Rated,"After finding an old rifle, a young boy joins the Soviet resistance movement against ruthless German forces and experiences the horrors of World War II.",1985-09-03,0
tt0093058,Full Metal Jacket,R,A pragmatic U.S. Marine observes the dehumanizing effects the Vietnam War has on his fellow recruits from their brutal boot camp training to the bloody street fighting in Hue.,1987-07-10,0
tt0119488,L.A. Confidential,R,"As corruption grows in 1950s Los Angeles, three policemen - one strait-laced, one brutal, and one sleazy - investigate a series of murders with their own brand of justice.",1997-09-19,0
tt0052357,Vertigo,PG,"A former San Francisco police detective juggles wrestling with his personal demons and becoming obsessed with the hauntingly beautiful woman he has been hired to trail, who may be deeply disturbed.",1958-05-22,0
tt0211915,Amélie,R,"Amélie is an innocent and naive girl in Paris with her own sense of justice. She decides to help those around her and, along the way, discovers love.",2002-02-08,0
tt0036775,Double Indemnity,Passed,"A Los Angeles insurance representative lets an alluring housewife seduce him into a scheme of insurance fraud and murder that arouses the suspicion of his colleague, an insurance investigator.",1944-07-06,0
tt0053604,The Apartment,Approved,"A Manhattan insurance clerk tries to rise in his company by letting its executives use his apartment for trysts, but complications and a romance of his own ensue.",1960-06-29,0
tt8267604,Capernaum,R,"While serving a five-year sentence for a violent crime, a 12-year-old boy sues his parents for neglect.",2018-09-20,0
tt2106476,The Hunt,R,"A teacher lives a lonely life, all the while struggling over his son's custody. His life slowly gets better as he finds love and receives good news from his son, but his new luck is about to be brutally shattered by an innocent little lie.",2013-01-10,0
tt0022100,M,Passed,"When the police in a German city are unable to catch a child-murderer, other criminals join in the manhunt.",1931-08-31,0
tt0056172,Lawrence of Arabia,Approved,"The story of T.E. Lawrence, the English officer who successfully united and led the diverse, often warring, Arab tribes during World War I in order to fight the Turks.",1962-12-11,0
tt0086250,Scarface,R,"In 1980 Miami, a determined Cuban immigrant takes over a drug cartel and succumbs to greed.",1983-12-09,0
tt0057565,High and Low,Not Rated,An executive of a Yokohama shoe company becomes a victim of extortion when his chauffeur's son is kidnapped by mistake and held for ransom.,1963-11-26,0
tt0033467,Citizen Kane,PG,"Following the death of publishing tycoon Charles Foster Kane, reporters scramble to uncover the meaning of his final utterance; 'Rosebud'.",1941-09-05,0
tt0105236,Reservoir Dogs,R,"When a simple jewelry heist goes horribly wrong, the surviving criminals begin to suspect that one of them is a police informant.",1992-09-02,0
tt0338013,Eternal Sunshine of the Spotless Mind,R,"When their relationship turns sour, a couple undergoes a medical procedure to have each other erased from their memories.",2004-03-19,0
tt5311514,Your Name.,TV-PG,"Two strangers find themselves linked in a bizarre way. When a connection forms, will distance be the only thing to keep them apart?",2017-04-07,0
tt0086190,Star Wars: Episode VI - Return of the Jedi,PG,"After a daring mission to rescue Han Solo from Jabba the Hutt, the Rebels dispatch to Endor to destroy the second Death Star. Meanwhile, Luke struggles to help Darth Vader back from the dark side without falling into the Emperor's trap.",1983-05-25,0
tt0045152,Singin' in the Rain,G,A silent film star falls for a chorus girl just as he and his delusionally jealous screen partner are trying to make the difficult transition to talking pictures in 1920s Hollywood.,1952-04-11,0
tt0180093,Requiem for a Dream,Unrated,The drug-induced utopias of four Coney Island people are shattered when their addictions run deep.,2000-12-15,0
tt0062622,2001: A Space Odyssey,G,"The Monoliths push humanity to reach for the stars; after their discovery in Africa generations ago, the mysterious objects lead mankind on an awesome journey to Jupiter, with the help of H.A.L. 9000: the world's greatest supercomputer.",1970-06-24,0
tt0066921,A Clockwork Orange,X,"In the future, a sadistic gang leader is imprisoned and volunteers for a conduct-aversion experiment, but it doesn't go as planned.",1972-02-02,0
tt0087843,Once Upon a Time in America,R,"A former Prohibition-era Jewish gangster returns to the Lower East Side of Manhattan 35 years later, where he must once again confront the ghosts and regrets of his old life.",1984-06-01,0
tt1187043,3 Idiots,PG-13,"Two friends are searching for their long lost companion. They revisit their college days and recall the memories of their friend who inspired them to think differently, even as the rest of the world called them 'idiots'.",2009-12-25,0
tt0082096,The Boat,User reviews,"The claustrophobic world of a WWII German U-boat; boredom, filth and sheer terror.",1982-02-10,0
tt0119217,Good Will Hunting,R,"Will Hunting, a janitor at M.I.T., has a gift for mathematics, but needs help from a psychologist to find direction in his life.",1998-01-09,0
tt4154796,Avengers: Endgame,PG-13,"After the devastating events of Avengers: Infinity War (2018), the universe is in ruins. With the help of remaining allies, the Avengers assemble once more in order to reverse Thanos' actions and restore balance to the universe.",2019-04-26,0
tt0435761,Toy Story 3,G,"The toys are mistakenly delivered to a day-care center instead of the attic right before Andy leaves for college, and it's up to Woody to convince the other toys that they weren't abandoned and to return home.",2010-06-18,0
tt0361748,Inglourious Basterds,R,"In Nazi-occupied France during World War II, a plan to assassinate Nazi leaders by a group of Jewish U.S. soldiers coincides with a theatre owner's vengeful plans for the same.",2009-08-21,0
tt2380307,Coco,PG,"Aspiring musician Miguel, confronted with his family's ancestral ban on music, enters the Land of the Dead to find his great-great-grandfather, a legendary singer.",2017-11-22,0
tt0119698,Princess Mononoke,PG-13,"On a journey to find the cure for a Tatarigami's curse, Ashitaka finds himself in the middle of a war between the forest gods and Tatara, a mining colony. In this quest he also meets San, the Mononoke Hime.",1997-12-19,0
tt0086879,Amadeus,PG,"The life, success and troubles of Wolfgang Amadeus Mozart, as told by Antonio Salieri, the contemporaneous composer who was insanely jealous of Mozart's talent and claimed to have murdered him.",1984-09-19,0
tt0114709,Toy Story,G,A cowboy doll is profoundly threatened and jealous when a new spaceman figure supplants him as top toy in a boy's room.,1995-11-22,0
tt0364569,Old Boy,R,"After being kidnapped and imprisoned for fifteen years, Oh Dae-Su is released, only to find that he must find his captor in five days.",2003-11-21,0
tt4633694,Spider-Man: Into the Spider-Verse,PG,"Teen Miles Morales becomes the Spider-Man of his universe, and must join with five spider-powered individuals from other dimensions to stop a threat for all realities.",2018-12-14,0
tt7286456,Joker,R,"In Gotham City, mentally troubled comedian Arthur Fleck is disregarded and mistreated by society. He then embarks on a downward spiral of revolution and bloody crime. This path brings him face-to-face with his alter-ego: the Joker.",2019-10-04,0
tt1345836,The Dark Knight Rises,PG-13,"Eight years after the Joker's reign of anarchy, Batman, with the help of the enigmatic Catwoman, is forced from his exile to save Gotham City from the brutal guerrilla terrorist Bane.",2012-07-20,0
tt0169547,American Beauty,R,A sexually frustrated suburban father has a mid-life crisis after becoming infatuated with his daughter's best friend.,1999-10-01,0
tt0057012,Dr. Strangelove or: How I Learned to Stop Worrying and Love the Bomb,PG,"An insane American general orders a bombing attack on the Soviet Union, triggering a path to nuclear holocaust that a war room full of politicians and generals frantically tries to stop.",1964-01-29,0
tt0112573,Braveheart,R,Scottish warrior William Wallace leads his countrymen in a rebellion to free his homeland from the tyranny of King Edward I of England.,1995-05-24,0
tt0053125,North by Northwest,Approved,"A New York City advertising executive goes on the run after being mistaken for a government agent by a group of foreign spies, and falls for a woman whose loyalties he begins to doubt.",1959-12-18,0
tt0090605,Aliens,R,"Fifty-seven years after surviving an apocalyptic attack aboard her space vessel by merciless space creatures, Officer Ripley awakens from hyper-sleep and tries to warn anyone who will listen about the predators.",1986-07-18,0
tt0032553,The Great Dictator,G,Dictator Adenoid Hynkel tries to expand his empire while a poor Jewish barber tries to avoid persecution from Hynkel's regime.,1941-03-07,0
tt4154756,Avengers: Infinity War,PG-13,The Avengers and their allies must be willing to sacrifice all in an attempt to defeat the powerful Thanos before his blitz of devastation and ruin puts an end to the universe.,2018-04-27,0
tt0050825,Paths of Glory,Approved,"After refusing to attack an enemy position, a general accuses the soldiers of cowardice and their commanding officer must defend them.",1957-12-25,0
tt0051201,Witness for the Prosecution,Approved,A veteran British barrister must defend his client in a murder trial that has surprise after surprise.,1958-02-06,0
tt0082971,Indiana Jones and the Raiders of the Lost Ark,PG,"In 1936, archaeologist and adventurer Indiana Jones is hired by the U.S. government to find the Ark of the Covenant before Adolf Hitler's Nazis can obtain its awesome powers.",1981-06-12,0
tt1853728,Django Unchained,R,"With the help of a German bounty-hunter, a freed slave sets out to rescue his wife from a brutal plantation-owner in Mississippi.",2012-12-25,0
tt0910970,WALL·E,G,"In the distant future, a small waste-collecting robot inadvertently embarks on a space journey that will ultimately decide the fate of mankind.",2008-06-27,0
tt0209144,Memento,R,A man with short-term memory loss attempts to track down his wife's murderer.,2001-05-25,0
tt0021749,City Lights,G,"With the aid of a wealthy erratic tippler, a dewy-eyed tramp who has fallen in love with a sightless flower girl accumulates money to be able to help her medically.",1931-03-07,0
tt0078788,Apocalypse Now,R,A U.S. Army officer serving in Vietnam is tasked with assassinating a renegade Special Forces Colonel who sees himself as a god.,1979-08-15,0
tt0078748,Alien,R,The crew of a commercial spacecraft encounter a deadly lifeform after investigating an unknown transmission.,1979-06-22,0
tt0095765,Cinema Paradiso,PG,A filmmaker recalls his childhood when falling in love with the pictures at the cinema of his home village and forms a deep friendship with the cinema's projectionist.,1990-02-23,0
tt0047396,Rear Window,PG,"A wheelchair-bound photographer spies on his neighbors from his Greenwich Village courtyard apartment window, and becomes convinced one of them has committed murder, despite the skepticism of his fashion-model girlfriend.",1954-09-01,0
tt0027977,Modern Times,G,The Tramp struggles to live in modern industrial society with the help of a young homeless woman.,1936-02-25,0
tt0064116,Once Upon a Time in the West,PG-13,A mysterious stranger with a harmonica joins forces with a notorious desperado to protect a beautiful widow from a ruthless assassin working for the railroad.,1969-07-04,0
tt0095327,Grave of the Fireflies,Not Rated,A young boy and his little sister struggle to survive in Japan during World War II.,1989-07-26,0
tt1675434,The Intouchables,R,"After he becomes a quadriplegic from a paragliding accident, an aristocrat hires a young man from the projects to be his caregiver.",2011-11-02,0
tt0407887,The Departed,R,An undercover cop and a mole in the police attempt to identify each other while infiltrating an Irish gang in South Boston.,2006-10-06,0
tt2582802,Whiplash,R,A promising young drummer enrolls at a cut-throat music conservatory where his dreams of greatness are mentored by an instructor who will stop at nothing to realize a student's potential.,2014-10-15,0
tt108726x,Spider-Man: No Way Home,PG-13,"With Spider-Man's identity now revealed, Peter asks Doctor Strange for help. When a spell goes wrong, dangerous foes from other worlds start to appear, forcing Peter to discover what it truly means to be Spider-Man.",2021-12-17,0
tt0482571,The Prestige,PG-13,"After a tragic accident, two stage magicians in 1890s London engage in a battle to create the ultimate illusion while sacrificing everything they have to outwit each other.",2006-10-20,0
tt0114814,The Usual Suspects,R,"A sole survivor tells of the twisty events leading up to a horrific gun battle on a boat, which began when five criminals met at a seemingly random police lineup.",1995-08-16,0
tt0056058,Hara-Kiri,Not Rated,"When a ronin requesting seppuku at a feudal lord's palace is told of the brutal suicide of another ronin who previously visited, he reveals how their pasts are intertwined - and in doing so challenges the clan's integrity.",1964-08-04,0
tt0120586,American History X,R,A former neo-nazi skinhead tries to prevent his younger brother from going down the same wrong path that he did.,1998-11-20,0
tt0172495,Gladiator,R,A former Roman General sets out to exact vengeance against the corrupt emperor who murdered his family and sent him into slavery.,2000-05-05,0
tt0034583,Casablanca,PG,A cynical expatriate American cafe owner struggles to decide whether or not to help his former lover and her fugitive husband escape the Nazis in French Morocco.,1943-01-23,0
tt6751668,Parasite,R,Greed and class discrimination threaten the newly formed symbiotic relationship between the wealthy Park family and the destitute Kim clan.,2019-11-08,0
tt0110357,The Lion King,G,"Lion prince Simba and his father are targeted by his bitter uncle, who wants to ascend the throne himself.",1994-06-24,0
tt0110413,Léon: The Professional,R,"12-year-old Mathilda is reluctantly taken in by Léon, a professional assassin, after her family is murdered. An unusual relationship forms as she becomes his protégée and learns the assassin's trade.",1994-11-18,0
tt0245429,Spirited Away,PG,"During her family's move to the suburbs, a sullen 10-year-old girl wanders into a world ruled by gods, witches, and spirits, and where humans are changed into beasts.",2003-03-28,0
tt0088763,Back to the Future,PG,"Marty McFly, a 17-year-old high school student, is accidentally sent thirty years into the past in a time-traveling DeLorean invented by his close friend, the eccentric scientist Doc Brown.",1985-07-03,0
tt0253474,The Pianist,R,A Polish Jewish musician struggles to survive the destruction of the Warsaw ghetto of World War II.,2003-03-28,0
tt0054215,Psycho,R,"A Phoenix secretary embezzles $40,000 from her employer's client, goes on the run, and checks into a remote motel run by a young man under the domination of his mother.",1960-09-08,0
tt0103064,Terminator 2: Judgment Day,R,"A cyborg, identical to the one who failed to kill Sarah Connor, must now protect her ten-year-old son John from a more advanced and powerful cyborg.",1991-07-03,0
tt0816692,Interstellar,PG-13,A team of explorers travel through a wormhole in space in an attempt to ensure humanity's survival.,2014-11-07,0
tt0076759,Star Wars,PG,"Luke Skywalker joins forces with a Jedi Knight, a cocky pilot, a Wookiee and two droids to save the galaxy from the Empire's world-destroying battle station, while also attempting to rescue Princess Leia from the mysterious Darth Vader.",1977-05-25,0
tt0317248,City of God,R,"In the slums of Rio, two kids' paths diverge as one struggles to become a photographer and the other a kingpin.",2004-02-13,0
tt0102926,The Silence of the Lambs,R,"A young F.B.I. cadet must receive the help of an incarcerated and manipulative cannibal killer to help catch another serial killer, a madman who skins his victims.",1991-02-14,0
tt0120815,Saving Private Ryan,R,"Following the Normandy Landings, a group of U.S. soldiers go behind enemy lines to retrieve a paratrooper whose brothers have been killed in action.",1998-07-24,0
tt0047478,Seven Samurai,Not Rated,A poor village under attack by bandits recruits seven unemployed samurai to help them defend themselves.,1956-11-19,0
tt0038650,It's a Wonderful Life,PG,An angel is sent from Heaven to help a desperately frustrated businessman by showing him what life would have been like if he had never existed.,1947-01-07,0
tt0073486,One Flew Over the Cuckoo's Nest,R,"A criminal pleads insanity and is admitted to a mental institution, where he rebels against the oppressive nurse and rallies up the scared patients.",1975-11-19,0
tt0114369,Se7en,R,"Two detectives, a rookie and a veteran, hunt a serial killer who uses the seven deadly sins as his motives.",1995-09-22,0
tt0133093,The Matrix,R,"When a beautiful stranger leads computer hacker Neo to a forbidding underworld, he discovers the shocking truth--the life he knows is the elaborate deception of an evil cyber-intelligence.",1999-03-31,0
tt0099685,Goodfellas,R,"The story of Henry Hill and his life in the mob, covering his relationship with his wife Karen Hill and his mob partners Jimmy Conway and Tommy DeVito in the Italian-American crime syndicate.",1990-09-21,0
tt0120689,The Green Mile,R,"The lives of guards on Death Row are affected by one of their charges: a black man accused of child murder and rape, yet who has a mysterious gift.",1999-12-10,0
tt0080684,Star Wars: Episode V - The Empire Strikes Back,PG,"After the Rebels are brutally overpowered by the Empire on the ice planet Hoth, Luke Skywalker begins Jedi training with Yoda, while his friends are pursued across the galaxy by Darth Vader and bounty hunter Boba Fett.",1980-06-20,0
tt0167261,The Lord of the Rings: The Two Towers,PG,"While Frodo and Sam edge closer to Mordor with the help of the shifty Gollum, the divided fellowship makes a stand against Sauron's new ally, Saruman, and his hordes of Isengard.",2002-12-18,0
tt0118799,Life Is Beautiful,PG-13,"When an open-minded Jewish waiter and his son become victims of the Holocaust, he uses a perfect mixture of will, humor, and imagination to protect his son from the dangers around their camp.",1997-12-20,0
